{
  "meta": {
    "id": "L27_Tight_Budget",
    "title": "Tight Budget",
    "schemaVersion": "0.2.3",
    "seed": 3027
  },
  "bounds": { "x": 10, "y": 22, "z": 10 },
  "initialVoxels": [],
  "objectives": [ { "type": "REACH_HEIGHT", "params": { "height": 5 } } ],
  "rotation": { "allowedDirections": [ "Down" ] },
  "bag": { "type": "FIXED_SEQUENCE", "sequence": ["O2","O2","I3","O2","I4","O2","L3","O2","T3","O2","O2"] },
  "hazards": [],
  "abilities": { "holdEnabled": false, "stabilizeCharges": 0 },
  "constraints": {},
  "stars": {}
}
