{
  "meta": {
    "id": "L24_First_Gust",
    "title": "First Gust",
    "schemaVersion": "0.2.3",
    "seed": 3024
  },
  "bounds": {
    "x": 10,
    "y": 20,
    "z": 10
  },
  "initialVoxels": [],
  "objectives": [
    {
      "type": "REACH_HEIGHT",
      "params": { "height": 6 }
    }
  ],
  "rotation": {
    "allowedDirections": [ "Down" ]
  },
  "bag": {
    "type": "FIXED_SEQUENCE",
    "sequence": [ "O2","I3","O2","I4","O2","L3","O2","T3","O2","I3" ]
  },
  "hazards": [
    {
      "type": "WIND_GUST",
      "enabled": true,
      "params": {
        "intervalTicks": 720,
        "pushStrength": 1,
        "directionMode": "ALTERNATE_EW",
        "firstGustOffsetTicks": 120
      }
    }
  ],
  "abilities": {
    "holdEnabled": false,
    "stabilizeCharges": 0
  },
  "constraints": {},
  "stars": {}
}
