{
  "meta": {
    "id": "L25_Stabilize",
    "title": "Stabilize",
    "schemaVersion": "0.2.3",
    "seed": 3025
  },
  "bounds": {
    "x": 10,
    "y": 20,
    "z": 10
  },
  "initialVoxels": [],
  "objectives": [
    {
      "type": "REACH_HEIGHT",
      "params": { "height": 8 }
    }
  ],
  "rotation": {
    "allowedDirections": [ "Down" ]
  },
  "bag": {
    "type": "FIXED_SEQUENCE",
    "sequence": [ "O2","L3","O2","I3","O2","T3","O2","I4","O2","O2","O2","O2" ]
  },
  "hazards": [],
  "abilities": {
    "holdEnabled": false,
    "stabilizeCharges": 1
  },
  "constraints": {},
  "stars": {}
}
