{
  "meta": {
    "id": "L02_First_Tilt",
    "title": "First Tilt",
    "schemaVersion": "0.2.3",
    "seed": 1002
  },
  "bounds": {
    "x": 10,
    "y": 12,
    "z": 10
  },
  "initialVoxels": [],
  "objectives": [
    {
      "type": "REACH_HEIGHT",
      "params": {
        "height": 6
      }
    }
  ],
  "rotation": {
    "maxRotations": 3,
    "allowedDirections": [
      "Down",
      "East",
      "West"
    ]
  },
  "bag": {
    "type": "FIXED_SEQUENCE",
    "sequence": [
      "O2"
    ]
  },
  "hazards": [],
  "abilities": {
    "holdEnabled": false,
    "stabilizeCharges": 0
  },
  "constraints": {},
  "stars": {
    "star3": [
      {
        "type": "MAX_SHIFT_VOXELS_TOTAL",
        "params": {
          "count": 0
        }
      }
    ]
  }
}
