{
  "meta": {
    "id": "L03_Four_Winds",
    "title": "Four Winds",
    "schemaVersion": "0.2.3",
    "seed": 1003
  },
  "bounds": {
    "x": 10,
    "y": 12,
    "z": 10
  },
  "initialVoxels": [],
  "objectives": [
    {
      "type": "REACH_HEIGHT",
      "params": {
        "height": 8
      }
    }
  ],
  "rotation": {
    "cooldownTicks": 90,
    "allowedDirections": [
      "Down",
      "North",
      "South",
      "East",
      "West"
    ]
  },
  "bag": {
    "type": "FIXED_SEQUENCE",
    "sequence": [
      "O2"
    ]
  },
  "hazards": [],
  "abilities": {
    "holdEnabled": false,
    "stabilizeCharges": 0
  },
  "constraints": {},
  "stars": {
    "star2": [
      {
        "type": "MAX_ROTATIONS_USED",
        "params": {
          "count": 2
        }
      }
    ]
  }
}
