{
  "meta": {
    "id": "L13_Dig_a_Channel",
    "title": "Dig a Channel",
    "schemaVersion": "0.2.3",
    "seed": 1013
  },
  "bounds": {
    "x": 10,
    "y": 16,
    "z": 10
  },
  "initialVoxels": [
    {
      "pos": {
        "x": 0,
        "y": 0,
        "z": 0
      },
      "type": "Solid"
    },
    {
      "pos": {
        "x": 0,
        "y": 0,
        "z": 1
      },
      "type": "Solid"
    },
    {
      "pos": {
        "x": 0,
        "y": 0,
        "z": 2
      },
      "type": "Solid"
    },
    {
      "pos": {
        "x": 0,
        "y": 0,
        "z": 3
      },
      "type": "Solid"
    },
    {
      "pos": {
        "x": 0,
        "y": 0,
        "z": 4
      },
      "type": "Solid"
    },
    {
      "pos": {
        "x": 1,
        "y": 0,
        "z": 0
      },
      "type": "Solid"
    },
    {
      "pos": {
        "x": 1,
        "y": 0,
        "z": 4
      },
      "type": "Solid"
    },
    {
      "pos": {
        "x": 2,
        "y": 0,
        "z": 0
      },
      "type": "Solid"
    },
    {
      "pos": {
        "x": 2,
        "y": 0,
        "z": 4
      },
      "type": "Solid"
    },
    {
      "pos": {
        "x": 3,
        "y": 0,
        "z": 0
      },
      "type": "Solid"
    },
    {
      "pos": {
        "x": 3,
        "y": 0,
        "z": 4
      },
      "type": "Solid"
    },
    {
      "pos": {
        "x": 4,
        "y": 0,
        "z": 0
      },
      "type": "Solid"
    },
    {
      "pos": {
        "x": 4,
        "y": 0,
        "z": 4
      },
      "type": "Solid"
    },
    {
      "pos": {
        "x": 5,
        "y": 0,
        "z": 0
      },
      "type": "Solid"
    },
    {
      "pos": {
        "x": 5,
        "y": 0,
        "z": 4
      },
      "type": "Solid"
    },
    {
      "pos": {
        "x": 6,
        "y": 0,
        "z": 0
      },
      "type": "Solid"
    },
    {
      "pos": {
        "x": 6,
        "y": 0,
        "z": 4
      },
      "type": "Solid"
    },
    {
      "pos": {
        "x": 7,
        "y": 0,
        "z": 0
      },
      "type": "Solid"
    },
    {
      "pos": {
        "x": 7,
        "y": 0,
        "z": 1
      },
      "type": "Solid"
    },
    {
      "pos": {
        "x": 7,
        "y": 0,
        "z": 2
      },
      "type": "Solid"
    },
    {
      "pos": {
        "x": 7,
        "y": 0,
        "z": 3
      },
      "type": "Solid"
    },
    {
      "pos": {
        "x": 7,
        "y": 0,
        "z": 4
      },
      "type": "Solid"
    },
    {
      "pos": {
        "x": 0,
        "y": 1,
        "z": 0
      },
      "type": "Solid"
    },
    {
      "pos": {
        "x": 0,
        "y": 1,
        "z": 1
      },
      "type": "Solid"
    },
    {
      "pos": {
        "x": 0,
        "y": 1,
        "z": 2
      },
      "type": "Solid"
    },
    {
      "pos": {
        "x": 0,
        "y": 1,
        "z": 3
      },
      "type": "Solid"
    },
    {
      "pos": {
        "x": 0,
        "y": 1,
        "z": 4
      },
      "type": "Solid"
    },
    {
      "pos": {
        "x": 1,
        "y": 1,
        "z": 0
      },
      "type": "Solid"
    },
    {
      "pos": {
        "x": 1,
        "y": 1,
        "z": 4
      },
      "type": "Solid"
    },
    {
      "pos": {
        "x": 2,
        "y": 1,
        "z": 0
      },
      "type": "Solid"
    },
    {
      "pos": {
        "x": 2,
        "y": 1,
        "z": 4
      },
      "type": "Solid"
    },
    {
      "pos": {
        "x": 3,
        "y": 1,
        "z": 0
      },
      "type": "Solid"
    },
    {
      "pos": {
        "x": 3,
        "y": 1,
        "z": 4
      },
      "type": "Solid"
    },
    {
      "pos": {
        "x": 4,
        "y": 1,
        "z": 0
      },
      "type": "Solid"
    },
    {
      "pos": {
        "x": 4,
        "y": 1,
        "z": 4
      },
      "type": "Solid"
    },
    {
      "pos": {
        "x": 5,
        "y": 1,
        "z": 0
      },
      "type": "Solid"
    },
    {
      "pos": {
        "x": 5,
        "y": 1,
        "z": 4
      },
      "type": "Solid"
    },
    {
      "pos": {
        "x": 6,
        "y": 1,
        "z": 0
      },
      "type": "Solid"
    },
    {
      "pos": {
        "x": 6,
        "y": 1,
        "z": 4
      },
      "type": "Solid"
    },
    {
      "pos": {
        "x": 7,
        "y": 1,
        "z": 0
      },
      "type": "Solid"
    },
    {
      "pos": {
        "x": 7,
        "y": 1,
        "z": 1
      },
      "type": "Solid"
    },
    {
      "pos": {
        "x": 7,
        "y": 1,
        "z": 2
      },
      "type": "Solid"
    },
    {
      "pos": {
        "x": 7,
        "y": 1,
        "z": 3
      },
      "type": "Solid"
    },
    {
      "pos": {
        "x": 7,
        "y": 1,
        "z": 4
      },
      "type": "Solid"
    },
    {
      "pos": {
        "x": 4,
        "y": 0,
        "z": 1
      },
      "type": "Solid"
    },
    {
      "pos": {
        "x": 4,
        "y": 1,
        "z": 1
      },
      "type": "Solid"
    },
    {
      "pos": {
        "x": 4,
        "y": 0,
        "z": 3
      },
      "type": "Solid"
    },
    {
      "pos": {
        "x": 4,
        "y": 1,
        "z": 3
      },
      "type": "Solid"
    },
    {
      "pos": {
        "x": 5,
        "y": 0,
        "z": 1
      },
      "type": "Solid"
    },
    {
      "pos": {
        "x": 5,
        "y": 1,
        "z": 1
      },
      "type": "Solid"
    },
    {
      "pos": {
        "x": 5,
        "y": 0,
        "z": 3
      },
      "type": "Solid"
    },
    {
      "pos": {
        "x": 5,
        "y": 1,
        "z": 3
      },
      "type": "Solid"
    },
    {
      "pos": {
        "x": 6,
        "y": 0,
        "z": 1
      },
      "type": "Solid"
    },
    {
      "pos": {
        "x": 6,
        "y": 1,
        "z": 1
      },
      "type": "Solid"
    },
    {
      "pos": {
        "x": 6,
        "y": 0,
        "z": 3
      },
      "type": "Solid"
    },
    {
      "pos": {
        "x": 6,
        "y": 1,
        "z": 3
      },
      "type": "Solid"
    },
    {
      "pos": {
        "x": 2,
        "y": 0,
        "z": 2
      },
      "type": "Drain",
      "drain": {
        "ratePerResolve": 6,
        "scope": "Adj26"
      }
    },
    {
      "pos": {
        "x": 1,
        "y": 0,
        "z": 1
      },
      "type": "Water"
    },
    {
      "pos": {
        "x": 1,
        "y": 0,
        "z": 2
      },
      "type": "Water"
    },
    {
      "pos": {
        "x": 1,
        "y": 0,
        "z": 3
      },
      "type": "Water"
    },
    {
      "pos": {
        "x": 2,
        "y": 0,
        "z": 1
      },
      "type": "Water"
    },
    {
      "pos": {
        "x": 2,
        "y": 0,
        "z": 3
      },
      "type": "Water"
    },
    {
      "pos": {
        "x": 3,
        "y": 0,
        "z": 1
      },
      "type": "Water"
    },
    {
      "pos": {
        "x": 3,
        "y": 0,
        "z": 2
      },
      "type": "Water"
    },
    {
      "pos": {
        "x": 3,
        "y": 0,
        "z": 3
      },
      "type": "Water"
    },
    {
      "pos": {
        "x": 4,
        "y": 0,
        "z": 2
      },
      "type": "Water"
    },
    {
      "pos": {
        "x": 5,
        "y": 0,
        "z": 2
      },
      "type": "Water"
    },
    {
      "pos": {
        "x": 1,
        "y": 1,
        "z": 1
      },
      "type": "Water"
    },
    {
      "pos": {
        "x": 1,
        "y": 1,
        "z": 2
      },
      "type": "Water"
    },
    {
      "pos": {
        "x": 1,
        "y": 1,
        "z": 3
      },
      "type": "Water"
    },
    {
      "pos": {
        "x": 2,
        "y": 1,
        "z": 1
      },
      "type": "Water"
    },
    {
      "pos": {
        "x": 2,
        "y": 1,
        "z": 3
      },
      "type": "Water"
    },
    {
      "pos": {
        "x": 3,
        "y": 1,
        "z": 1
      },
      "type": "Water"
    },
    {
      "pos": {
        "x": 3,
        "y": 1,
        "z": 2
      },
      "type": "Water"
    },
    {
      "pos": {
        "x": 3,
        "y": 1,
        "z": 3
      },
      "type": "Water"
    }
  ],
  "objectives": [
    {
      "type": "DRAIN_WATER",
      "params": {
        "targetUnits": 18
      }
    }
  ],
  "rotation": {
    "allowedDirections": [
      "Down",
      "East",
      "West"
    ]
  },
  "bag": {
    "type": "FIXED_SEQUENCE",
    "sequence": [
      "O2",
      "O2",
      "O2"
    ]
  },
  "hazards": [],
  "abilities": {
    "holdEnabled": false,
    "stabilizeCharges": 0
  },
  "constraints": {},
  "stars": {
    "star3": [
      {
        "type": "MAX_ROTATIONS_USED",
        "params": {
          "count": 4
        }
      }
    ]
  }
}
