{
  "meta": {
    "id": "L08_Tilt_Budget",
    "title": "Tilt Budget",
    "schemaVersion": "0.2.3",
    "seed": 1008
  },
  "bounds": {
    "x": 10,
    "y": 16,
    "z": 10
  },
  "initialVoxels": [],
  "objectives": [
    {
      "type": "REACH_HEIGHT",
      "params": {
        "height": 12
      }
    }
  ],
  "rotation": {
    "tiltBudget": 6,
    "allowedDirections": [
      "Down",
      "East",
      "West"
    ]
  },
  "bag": {
    "type": "FIXED_SEQUENCE",
    "sequence": [
      "O2"
    ]
  },
  "hazards": [],
  "abilities": {
    "holdEnabled": false,
    "stabilizeCharges": 0
  },
  "constraints": {},
  "stars": {
    "star3": [
      {
        "type": "MAX_ROTATIONS_USED",
        "params": {
          "count": 4
        }
      }
    ]
  }
}
