{
  "meta": {
    "id": "L04_Unsupported",
    "title": "Unsupported",
    "schemaVersion": "0.2.3",
    "seed": 1004
  },
  "bounds": {
    "x": 10,
    "y": 12,
    "z": 10
  },
  "initialVoxels": [
    {
      "pos": { "x": 4, "y": 3, "z": 4 },
      "type": "Solid"
    },
    {
      "pos": { "x": 5, "y": 3, "z": 4 },
      "type": "Solid"
    },
    {
      "pos": { "x": 6, "y": 3, "z": 4 },
      "type": "Solid"
    }
  ],
  "objectives": [
    {
      "type": "SURVIVE_ROTATIONS",
      "params": {
        "rotations": 2
      }
    }
  ],
  "rotation": {
    "allowedDirections": [
      "Down",
      "East",
      "West"
    ]
  },
  "bag": {
    "type": "FIXED_SEQUENCE",
    "sequence": [
      "O2"
    ]
  },
  "hazards": [],
  "abilities": {
    "holdEnabled": false,
    "stabilizeCharges": 0
  },
  "constraints": {},
  "stars": {
    "star2": [
      {
        "type": "MAX_LOST_VOXELS_TOTAL",
        "params": {
          "count": 5
        }
      }
    ],
    "star3": [
      {
        "type": "MAX_LOST_VOXELS_TOTAL",
        "params": {
          "count": 1
        }
      }
    ]
  }
}
