{
  "meta": {
    "id": "L21_Weight_Limit",
    "title": "Weight Limit",
    "schemaVersion": "0.2.3",
    "seed": 3021
  },
  "bounds": {
    "x": 10,
    "y": 20,
    "z": 10
  },
  "initialVoxels": [],
  "objectives": [
    {
      "type": "REACH_HEIGHT",
      "params": { "height": 4 }
    }
  ],
  "rotation": {
    "allowedDirections": [ "Down" ]
  },
  "bag": {
    "type": "FIXED_SEQUENCE",
    "sequence": [
      "O2","O2","O2","O2","O2","O2","O2","O2","O2","O2"
    ]
  },
  "hazards": [],
  "abilities": {
    "holdEnabled": false,
    "stabilizeCharges": 0
  },
  "constraints": {
    "maxMass": 250
  },
  "stars": {}
}
