{
  "meta": {
    "id": "L30_High_Rise_Exam",
    "title": "High-Rise Exam",
    "schemaVersion": "0.2.3",
    "seed": 3030
  },
  "bounds": { "x": 10, "y": 24, "z": 10 },
  "initialVoxels": [],
  "objectives": [ { "type": "REACH_HEIGHT", "params": { "height": 7 } } ],
  "rotation": { "allowedDirections": [ "Down" ] },
  "bag": { "type": "FIXED_SEQUENCE", "sequence": ["O2","I3","O2","I4","O2","L3","O2","T3","O2","I3","O2","O2","O2"] },
  "hazards": [ { "type": "WIND_GUST", "enabled": true, "params": { "intervalTicks": 540, "pushStrength": 1, "directionMode": "ALTERNATE_EW", "firstGustOffsetTicks": 120 } } ],
  "abilities": { "holdEnabled": false, "stabilizeCharges": 0 },
  "constraints": { "maxMass": 400 },
  "stars": {}
}
